{
  "documentKind": "synthetic_invoice",
  "invoiceNumber": "INV-SYNTH-001",
  "issuedAt": "2030-01-15",
  "currency": "JPY",
  "lines": [
    {
      "lineNo": 1,
      "description": "Widget Alpha",
      "quantity": 2,
      "unitPrice": 500,
      "amount": 1000
    },
    {
      "lineNo": 2,
      "description": "Service Beta",
      "quantity": 1,
      "unitPrice": 234,
      "amount": 234
    }
  ],
  "totalAmount": 1234
}
